{
  "schema_version": "0.1",
  "id": "m01-pcapng-as-dat-3d2bfbf11e3b",
  "path": "data\\fixtures\\m01-pcapng-as-dat.dat",
  "sha256": "3d2bfbf11e3b4ebd4a99cefa3f2ea118a36f5ecd220338fe5ee25b3069bb5793",
  "length": 724,
  "format": "pcapng",
  "format_evidence": [
    {
      "rule_id": "M01-FMT-PCAPNG-VALIDATED",
      "observation": "validated 1 pcapng section(s) and all block lengths; capinfos reports PCAPNG."
    }
  ],
  "metadata_availability": {
    "packet_boundaries": true,
    "network_headers": true,
    "flow_identity": true,
    "direction": true,
    "timestamps": true
  },
  "status": "ok",
  "byte_ranges": [
    {
      "start": 0,
      "end": 724,
      "artifact_ref": "data\\fixtures\\m01-pcapng-as-dat.dat"
    }
  ],
  "packets": [
    {
      "id": "m01-pcapng-as-dat-3d2bfbf11e3b-packet-1",
      "source_id": "m01-pcapng-as-dat-3d2bfbf11e3b",
      "index": 0,
      "timestamp_epoch": "1788762557.000001000",
      "interface_id": 0,
      "captured_length": 60,
      "original_length": 60,
      "truncated": false,
      "source_file_offset": null,
      "source_offset_reason": "frame.file_off was not populated by tshark",
      "tcp_stream": 0,
      "src_ip": "192.0.2.10",
      "src_port": 40000,
      "dst_ip": "192.0.2.20",
      "dst_port": 9000,
      "tcp_seq_raw": 0,
      "tcp_payload_length": 5,
      "payload_ref": "payloads/m01-pcapng-as-dat-3d2bfbf11e3b-packet-000001.bin",
      "analysis": {
        "retransmission": false,
        "out_of_order": false,
        "gap_or_loss": false
      }
    },
    {
      "id": "m01-pcapng-as-dat-3d2bfbf11e3b-packet-2",
      "source_id": "m01-pcapng-as-dat-3d2bfbf11e3b",
      "index": 1,
      "timestamp_epoch": "1788762557.000002000",
      "interface_id": 0,
      "captured_length": 60,
      "original_length": 60,
      "truncated": false,
      "source_file_offset": null,
      "source_offset_reason": "frame.file_off was not populated by tshark",
      "tcp_stream": 0,
      "src_ip": "192.0.2.10",
      "src_port": 40000,
      "dst_ip": "192.0.2.20",
      "dst_port": 9000,
      "tcp_seq_raw": 5,
      "tcp_payload_length": 6,
      "payload_ref": "payloads/m01-pcapng-as-dat-3d2bfbf11e3b-packet-000002.bin",
      "analysis": {
        "retransmission": false,
        "out_of_order": false,
        "gap_or_loss": false
      }
    },
    {
      "id": "m01-pcapng-as-dat-3d2bfbf11e3b-packet-3",
      "source_id": "m01-pcapng-as-dat-3d2bfbf11e3b",
      "index": 2,
      "timestamp_epoch": "1788762557.000003000",
      "interface_id": 0,
      "captured_length": 60,
      "original_length": 60,
      "truncated": false,
      "source_file_offset": null,
      "source_offset_reason": "frame.file_off was not populated by tshark",
      "tcp_stream": 0,
      "src_ip": "192.0.2.20",
      "src_port": 9000,
      "dst_ip": "192.0.2.10",
      "dst_port": 40000,
      "tcp_seq_raw": 0,
      "tcp_payload_length": 3,
      "payload_ref": "payloads/m01-pcapng-as-dat-3d2bfbf11e3b-packet-000003.bin",
      "analysis": {
        "retransmission": false,
        "out_of_order": false,
        "gap_or_loss": false
      }
    },
    {
      "id": "m01-pcapng-as-dat-3d2bfbf11e3b-packet-4",
      "source_id": "m01-pcapng-as-dat-3d2bfbf11e3b",
      "index": 3,
      "timestamp_epoch": "1788762557.000004000",
      "interface_id": 0,
      "captured_length": 60,
      "original_length": 60,
      "truncated": false,
      "source_file_offset": null,
      "source_offset_reason": "frame.file_off was not populated by tshark",
      "tcp_stream": 0,
      "src_ip": "192.0.2.10",
      "src_port": 40000,
      "dst_ip": "192.0.2.20",
      "dst_port": 9000,
      "tcp_seq_raw": 11,
      "tcp_payload_length": 1,
      "payload_ref": "payloads/m01-pcapng-as-dat-3d2bfbf11e3b-packet-000004.bin",
      "analysis": {
        "retransmission": false,
        "out_of_order": false,
        "gap_or_loss": false
      }
    }
  ],
  "flows": [
    {
      "id": "m01-pcapng-as-dat-3d2bfbf11e3b-tcp-flow-0",
      "source_id": "m01-pcapng-as-dat-3d2bfbf11e3b",
      "transport": "tcp",
      "tcp_stream": 0,
      "node0": {
        "ip": "192.0.2.10",
        "port": 40000
      },
      "node1": {
        "ip": "192.0.2.20",
        "port": 9000
      },
      "packet_ids": [
        "m01-pcapng-as-dat-3d2bfbf11e3b-packet-1",
        "m01-pcapng-as-dat-3d2bfbf11e3b-packet-2",
        "m01-pcapng-as-dat-3d2bfbf11e3b-packet-3",
        "m01-pcapng-as-dat-3d2bfbf11e3b-packet-4"
      ],
      "first_timestamp_epoch": "1788762557.000001000",
      "last_timestamp_epoch": "1788762557.000004000"
    }
  ],
  "streams": [
    {
      "id": "m01-pcapng-as-dat-3d2bfbf11e3b-tcp-stream-0",
      "source_id": "m01-pcapng-as-dat-3d2bfbf11e3b",
      "flow_id": "m01-pcapng-as-dat-3d2bfbf11e3b-tcp-flow-0",
      "tcp_stream": 0,
      "node0": {
        "ip": "192.0.2.10",
        "port": 40000
      },
      "node1": {
        "ip": "192.0.2.20",
        "port": 9000
      },
      "packet_ids": [
        "m01-pcapng-as-dat-3d2bfbf11e3b-packet-1",
        "m01-pcapng-as-dat-3d2bfbf11e3b-packet-2",
        "m01-pcapng-as-dat-3d2bfbf11e3b-packet-3",
        "m01-pcapng-as-dat-3d2bfbf11e3b-packet-4"
      ],
      "directions": [
        {
          "direction": "node0_to_node1",
          "length": 12,
          "sha256": "bf96648169ba89c284b3e94108074c7d5e5806c7b9498031aceded5ca139ed69",
          "artifact_ref": "streams/m01-pcapng-as-dat-3d2bfbf11e3b-tcp-0-node0_to_node1.bin"
        },
        {
          "direction": "node1_to_node0",
          "length": 3,
          "sha256": "a2f1a6d79bfb0fe6d2fe2f0f08c2f32ce53cc935520e9d8a9f8daa051b4f239b",
          "artifact_ref": "streams/m01-pcapng-as-dat-3d2bfbf11e3b-tcp-0-node1_to_node0.bin"
        }
      ],
      "analysis": {
        "retransmission_packets": 0,
        "out_of_order_packets": 0,
        "gap_or_loss_packets": 0,
        "truncated_packets": 0
      },
      "reassembly_status": "complete"
    }
  ],
  "warnings": [
    "TShark did not populate frame.file_off; packet source offsets are null."
  ]
}
